Column name,Definition
Date,Data collection date
UID,Country code: https://github.com/CSSEGISandData/COVID-19/blob/master/csse_covid_19_data/UID_ISO_FIPS_LookUp_Table.csv
Province_State,Name of the state
Country_Region,Name of the country (US)
Doses_admin,Cumulative number of doses administered including booster doses for states where it is reported as part of the total.
People_at_least_one_dose,Cumulative number of people who received at least one vaccine dose. When the person receives a prescribed second dose it is not counted twice
People_fully_vaccinated,Cumulative number of people who received a complete primary series. This means having received one dose of a single-dose vaccine or two doses on different days (regardless of time interval) of either a mRNA or a protein-based series. When the vaccine manufacturer is not reported the recipient is considered fully vaccinated with two doses.
Total_additional_doses,Cumulative number of all the additional or booster doses administered. This metric does not reflect individual people and each dose is counted independently  
