,date,policy,Restrict/Close,Opening (State),Deferring to County,Testing,Education,Health/Medical,Emergency Level,Transportation,Budget,Social Distancing,Other
76,"May 22, 2020", The Indiana Department of Homeland Security stated the agencys is continuing its code enforcement arm visits businesses every day to monitor safety codes and occupancy rates.,,,,,,,,,,,Y
77,"May 22, 2020"," The Indiana Economic Development Corporation stated that over 20,000 bundles of personal protective equipment have been shipped to businesses through the IEDCs marketplace. Another 15,000 are set to go out.",,,,,,Y,,,,,Y
78,"May 27, 2020"," The Governor announced the second phase of the IU School of Health Fairbanks research study will begin next week. The study found that the current statewide population prevalence rate is 2.8%, and 44.8% of those who tested positive were asymptomatic.",,,,,,,,,,,Y
79,"May 27, 2020"," The Family and Social Services Administration Secretary said 26% of all Medicaid mental health services from March-April of this year were provided through telehealth, as compared to 6% from March-April of last year.",,,,,,Y,,,,,Y
80,"May 27, 2020", The Director of the Office of Budget & Management said $5 billion has been awarded to Indiana from the federal government. About $2.4 billion is for coronavirus relief.,,,,,,,,,,,Y
81,"May 28, 2020", The Governor announced that he is currently working with local schools and the Indiana Department of Education (IDOE) to finalize details on what the fall semester will look like for K-12 students and that schools will likely reopen in the fall.,,,,,Y,,,,,,
82,"May 29, 2020"," The Governor announced several new economic recovery initiatives designed to bolster critical relief efforts while encouraging long-term planning and investments to stimulate Indianas economy well into the future. Through these initiatives, the state will allocate nearly $44 million to provide support and resources including approximately $37 million in direct funding through grants and investments to small businesses and manufacturers.",,,,,,,,,,,Y
83,"June 1, 2020", The Governor signed Executive Order 20-29 to lift restrictions on local declarations of emergency that had been instituted as a part of the stay at home and back on track orders pertaining to COVID-19. This order allows local governments to place more stringent travel restrictions than the state has in place.,,,Y,,,,,,,,
84,"June 3, 2020", The Governor announced the second phase of the Fairbanks study has started.,,,,,,,,,,,Y
85,"June 3, 2020"," The Indiana State Department of Health announced PPE supply chains for hospitals and suppliers have opened up, which has allowed Indiana to build its own inventory in case of a second wave of the virus in the fall.",,,,,,Y,,,,,Y
86,"June 3, 2020", The Governor announced Indiana received $17 million in additional funding through the CARES Act for the Low Income Home Energy Assistance Program.,,,,,,,,,,,Y
87,"June 5, 2020","- The Governor announced that $50 million in federal funding is being provided through the CARES Act to help Indianans get jobs. The funding will provide free access to online courses and training and will also create an online network that can connect people with career coaches. The Employer Training Grant will also be expanded, with a portion of funds dedicated to supporting minority, women and veteran-owned businesses.",,,,,,,,,,,Y
88,"June 10, 2020"," The Governor announced plans for the state to enter Stage 4 of reopening, which is set to begin June 14.  The Governor announced that officials are still discussing whether to extend the moratorium on evictions.  The Indiana Department of Health announced that the state has partnered with Eli Lilly and the Indiana Hospital Association to launch a lab testing network to increase daily testing capacity. The network will include 10 labs across the state. The network will leverage the states buying power to better compete for testing supplies.",,Y,,,,,,,,,Y
89,"June 10, 2020", The Governor announced that officials are still discussing whether to extend the moratorium on evictions.,,,,,,,,,,,Y
90,"June 10, 2020", The Indiana Department of Health announced that the state has partnered with Eli Lilly and the Indiana Hospital Association to launch a lab testing network to increase daily testing capacity. The network will include 10 labs across the state. The network will leverage the states buying power to better compete for testing supplies.,,,,Y,Y,,,,,,
91,"June 10, 2020", The Governor announced that officials are still discussing whether to extend the moratorium on evictions.,,,,Y,Y,,,,,,
92,"June 10, 2020", The Indiana Department of Health announced that the state has partnered with Eli Lilly and the Indiana Hospital Association to launch a lab testing network to increase daily testing capacity. The network will include 10 labs across the state. The network will leverage the states buying power to better compete for testing supplies.,,,,,,,,,Y,,
93,"June 15, 2020", The Indiana State Department of Health announced that OptumServe testing sites will be open to anyone regardless of whether they are high-risk or symptomatic.,,,,,,,,,,,Y
94,"June 15, 2020", The State Office of Management and Budget predicted that the state would be $2 billion behind its revenue forecast due to COVID-19 impacts.,,,,,Y,,,,,,
95,"June 15, 2020", The Governor announced that the state COVID-19 briefings will be reduced only once per week.,,,,,Y,,,,,,
96,"June 17, 2020", The Governor announced a 183 million increase in K-12 spending and that Indiana school corporations will get an additional $192 million out of the federal CARES Act. $61 million from the governors emergency fund will help with eLearning.,,,,,,,,,,,Y
97,"June 22, 2020"," The Governor announced that Indiana PK-12 schools and higher education institutions can now apply for a needs-based, competitive $61.6 million grant program providing funding to improve remote learning.",,,,,,,,,,,
98,"June 24, 2020"," The Indiana Housing and Community Development Authority Executive Director announced a new rental assistance program will provide up to $500 a month per household for those who are unable to pay rent due to a COVID-19 related job loss. Households can qualify for up to four months of assistance, or $2,000. An estimated 12,000 household renters will be served.",,,,,,,,,,,
99,"July 1, 2020"," The Governor announced the state will modify the Back On Track Indiana plan through at least July 17. Most restrictions will stay in place, including the following:Social gatherings following the CDCs social distancing guidelines will be limited to up to 250 people. This limit applies to wedding receptions, parties, and other events where people are in close physical contact for extended periods of time, particularly indoors.Dining room food service may continue operations at up to 75 percent capacity as long as social distancing is observed. Bar seating in restaurants may continue operations at 50 percent capacity. Bars and nightclubs may continue operations open at 50 percent capacity as long as they adhere to social distancing guidelines.Cultural, entertainment, and tourism sites may continue operations open at 50 percent capacity.Movie theaters, bowling alleys, and similar facilities may continue operations open at 50 percent capacity.Amusement parks, water parks and similar facilities may continue operations open at 50 percent capacity. Reservations are encouraged to limit the number of customers at any one time.Raceways may continue operations open at 50 percent grandstand capacity",,,,,,,,,,,
