date,policy,Restrict/Close,Opening (State),Deferring to County,Testing,Education,Health/Medical,Emergency Level,Transportation,Budget,Social Distancing,Other,Vaccine
4-Mar-20,"Governor Baker announced that due to the emergency health situation, the state is urging colleges and universities to cancel upcoming organized international trips.",Y,,,,,,,,,,,
10-Mar-20,Governor Baker declared a state of emergency.,,,,,,,Y,,,,Y,
10-Mar-20,Broad restrictions are imposed on travel for many state employees,Y,,,,,,,,,,,
12-Mar-20,"Governor Baker signed off on a $15 million dollar spending bill that will cover costs of monitoring, treating, containing and educating the public about COVID-19.",,,,,,,,,Y,,Y,
13-Mar-20,The state allowed medical professionals from other states to obtain a Massachusetts license in 24 hours.,,,,,,Y,,,,,Y,
13-Mar-20,Governor Baker announced a ban on all gatherings of 250 people or more.,Y,,,,,,,,,,,
15-Mar-20,"The Governor announced several new steps to address COVID-19, including the following: All public and private elementary and secondary schools will be closed for three weeks. Gatherings of more than 25 people are prohibited. Visitors are prohibited from entering long-term care facilities and nursing homes. The administration is filing emergency legislation that will allow new claims to be paid more quickly by waiving the one week waiting period for unemployment benefits.",Y,,,,Y,,,,,,,
15-Mar-20,"The Governor announced a new legislative package aimed at supporting municipal governance that allows changes to the postponing of town meetings, adopting lower quorum rules, permitting municipal spending of revolving funds, and other measures.",,,,,,,,,,,Y,
16-Mar-20,"The Governor announced a $10 million Small Business Recovery Loan Fund that aims to provide emergency capital (up to $75,000) to businesses in the state impacted by COVID-19.",,,,,,,,,Y,,Y,
17-Mar-20,"The Governor announced four new emergency orders that make the following changes: Licensed physicians who have retired in the last year, and who are in good standing, may be reactivated for a period of 90 days after the end of the public health emergency. Providers in good standing from other states can obtain emergency licenses to practice in the state, or practice through telemedicine. The ability of residents to provide critical services (under supervision) will be expanded. Allows licenses for nurses, pharmacists and physician assistants, who would otherwise be up for renewal, to extend their licensure status by 90 days after the end of the public health emergency. Adjusts the minimum standards for ambulance staffing to ensure capacity of EMS services. Expands telehealth by facilitating those services across state lines.",,,,,,Y,,,,,Y,
17-Mar-20,The Governor's administration is distributing $5 million in initial emergency funding to address needs of community health boards. Additional funding will support public health emergency resources in cities and towns.,,,,,,,,,,,Y,
17-Mar-20," Building off the Governors emergency loan fund, the Governor formally requested that the Small Business Administration issue a declaration of economic injury so as to expedite the ability for small business to obtain loans.",,,,,,,,,,,Y,
18-Mar-20,"The Governor announced that all early education and childcare centers will close on March 23, 2020.",Y,,,,Y,,,,,,,
18-Mar-20,The Governor signed Senate S.2599 authorizing unemployment assistance to workers impacted by COVID-19.The legislation will allow for new claims to be paid in an expedited fashion by waiving the one week waiting period for such benefits.,,,,,,,,,,,Y,
19-Mar-20,The Governor announced that the U.S. Small Business Administration will offer low-interest federal disaster loans for working capital to Massachusetts small businesses suffering substantial economic injury.,,,,,,,,,,,Y,
19-Mar-20,"The Governor activated the Massachusetts National Guard with up to 2,000 members who will support requests from state agencies for equipment, logistics, warehousing, and related duties.",,,,,,,,,,,Y,
19-Mar-20,"The Lieutenant Governor announced the Small Business Recovery Loan Fund will be allocated another $10 million, making the final amount $20 million, to help small businesses who sought emergency loans before the state was overrun with requests and stopped accepting applications.",,,,,,,,,,,Y,
23-Mar-20,"The Governor issued an emergency order requiring all businesses and organization who are not proving COVID-19 Essential Services to close their physical workplaces and facilities. Simultaneously, the Governor also stated that he is limiting mass gathering to 10 people or less.The order does not however prohibit gatherings of more than 10 people in an outdoor space.",Y,,,,,,,,,,,
16-Mar-20,The Massachusetts courts announced that no evictions would occur during the COVID-19 public health emergency until at least April 21.,,,,,,,,,,,Y,
24-Mar-20,"The Governor filed An Act to Further Address Challenges Faced by Municipalities and School Districts Resulting from COVID-19, which would provide administrative relief to state and local government entities in the form of modifying local permitting processes, enabling municipalities to extend tax and finance deadlines, and extending deadlines for certain education requirements.",,,,,,,,,,,Y,
24-Mar-20,The Governor announced the launch of a new text-based notification system to deliver important information about the Commonwealth's COVID-19 response to Massachusetts residents.,,,,,,,,,,,Y,
25-Mar-20,"The Governor announced new actions across the commonwealth, which include extending the closure of all public and private schools and non-emergency child care programs and actions to protect homeowners and low-income tenants from eviction and foreclosure.",Y,,,,Y,,,,,,,
25-Mar-20,"The Governor announced the creation of a COVID-19 Advisory Board, which includes a group of medical experts that will support the Response Command Center and actions across the commonwealth.",,,,,,,,,,,Y,
26-Mar-20,"The Centers for Medicare & Medicaid Services approved Massachusetts request for a Section 1135 Medicaid waiver.The approved waiver enables Massachusetts to provide flexibilities in Medicaid provider screening and enrollment, forgo certain pre-admission screening and annual resident review assessments, lift prior authorization requirements, allow for reimbursement facility services in alternative settings, extend fair hearing timelines, and waive public comment and tribal consultation requirements for certain changes to the Medicaid state plan.",,,,,,Y,,,,,,
27-Mar-20,The Governor announced that he extended the 2019 state individual income tax filing and payment deadline from April 15 to July 15.,,,,,,,,,,,Y,
27-Mar-20,"The Governor announced new public health emergency responses, by issuing guidelines on travel and transportation and offering support for health care professionals and patients. The follow measures will go into place: Travelers arriving to Massachusetts are instructed to self-quarantine for 14 days. State medical schools will facilitate early graduation of their qualified fourth-year students to allow graduates to support the health care workforce. The Board of Registration in Medicine will provide medical school graduates who have matched as an intern, resident or fellow with a Board-approved Massachusetts health care facility or training program with Emergency 90-Day Limited Licenses to practice medicine. The launch of Buoy Healths new online resource for residents to check their symptoms and connect with the next appropriate health care resource. A public health order to provide Advanced Practice Registered Nurses, in good standing, with greater flexibility in their prescribing practices.",Y,,,,,Y,,,,,,
27-Mar-20,The Governor announced a partnership with the Massachusetts Medical Society to match volunteers with communities and health care providers based on skillsets and need.,,,,,,Y,,,,,,
29-Mar-20,The Governor announced a new online portal where individuals and companies can easily donate or sell personal protective equipment and sign up to volunteer to support COVID-19 emergency response efforts.,,,,,,Y,,,,,,
30-Mar-20,"The Governor announced new actions that will support efforts to expand the Commonwealth's health care workforce, including expediting licensing for certain health care workers and onboarding for health care volunteers who have signed up through the Administrations new online volunteer portal.",,,,,,Y,,,,,,
30-Mar-20,The Department of Public Health ordered that certain MassHealth regulations regarding the transfers and discharge of long-term facility residents be waived for the purposes of moving residents to designated COVID-19 facilities.,,,,,,Y,,,,,,
31-Mar-20,The Governor announced updates to the list of businesses deemed to provide COVID-19 Essential Services and extended the non-essential business emergency order to May 4.,Y,,,,,,,,,,,
2-Apr-20,The Governor issued an emergency order requiring all coastal beach reservation parking areas managed by the Department of Conservation and Recreation to close. ,Y,,,,,,,,,,,
2-Apr-20,"The Governor's Administration, through the Response Command Center, outlined projections related to the anticipated surge of COVID-19 cases in the Commonwealth. ",,,,,,,,,,,Y,
3-Apr-20,"The Governor's Administration announced an initiative that will focus on tracing the contacts of confirmed positive COVID-19 patients, and supporting individuals in quarantine, and builds on the efforts already underway from the Command Center to leverage public health college students to augment the contact tracing being done by local boards of health. ",,,,,,Y,,,,,Y,
7-Apr-20,"The Governor, along with CVS, announced the launch of a new rapid testing site with the capability of testing 1,000 people a day, as well as same day results. ",,,,Y,,,,,,,,
7-Apr-20,"The Governor announced a new financial package to support providers through the MassHealth program, by providing $800 million crisis stabilization funding to support health care providers impacted by and responding to the public health emergency, $80 million to nursing facilities, and $400 million to safety net hospitals. ",,,,,,,,,,,Y,
8-Apr-20,The Governor filed legislation to provide health care workers and facilities protections from civil liability while they are on the front lines of response to this public health emergency. ,,,,,,Y,,,,,,
8-Apr-20,"The Governor's Administration announced an expansion of COVID-19 testing sites for public safety personnel, new Crisis Standards of Care documentation for the Commonwealth's health care facilities, and new guidance to further promote social distancing at grocery stores. ",,,,,,Y,,,,Y,,
9-Apr-20,"The Governor announced details for the initial implementation of federal unemployment benefits in the CARES Act, such as an additional $600 per week for individuals collecting benefits from regular unemployment compensation and a 13-week extension of benefits for individuals who exhausted their previous benefits. ",,,,,,,,,,,Y,
9-Apr-20,"The Governor announced the details for a new field medical station at the Boston Convention and Exhibition Center, increased support for health care workforce and patients, expansion of COVID-19 reporting data, new guidance for workers seeking unemployment benefits and protections for survivors of domestic violence and sexual assault.",,,,,,Y,,,,,,
10-Apr-20,The Governor's Administration provided an update on the Commonwealth's hospital capacity and efforts to add more beds to the system to meet the expected surge. ,,,,,,Y,,,,,,
10-Apr-20,"The Governor's Administration issued further public health guidance that all residents wear a mask or face covering in public, expanded access to free priority testing sites for first responders and grocery store workers. ",Y,,,Y,,,,,,,,
13-Apr-20,"The Governor announced a new initiative and over $10 million in funding to support manufacturers' efforts to pivot production operations to produce personal protective equipment and other critical devices, such as ventilators, sanitizers, and thermometers.The Manufacturing Emergency Response Team (M-ERT) is a coordinated response by the Governor's Administration and leading academic and industry stakeholders to support the Commonwealth's manufacturers in their efforts to produce much-needed supplies for front-line workers and the health care system. ",,,,,,,,,,,Y,
14-Apr-20,The Governor's Administration announced the expansion of COVID-19 response reporting to include statewide hospital capacity and PPE distribution data. ,,,,,,Y,,,,,,
15-Apr-20,"The Governor's Administration announced an additional $130 million in new funding to long-term care facilities, the expansion of mobile testing for these facilities, and crisis management support to assist with staffing, vendors, and implementing infectious control measures. ",,,,Y,,Y,,,,,Y,
17-Apr-20,"The Governor announced the distribution of approximately 200,000 respirator masks for local law enforcement and firefighters through the Massachusetts Emergency Management Agency. ",,,,,,,,,,,Y,
17-Apr-20,"The Governor outlined the states ongoing comprehensive strategy to address homelessness during the COVID-19 pandemic through the establishment of isolation and recovery sites, deployment of supplies and supporting families in emergency assistance and domestic violence shelters. ",,,,,,,,,,,Y,
20-Apr-20,"The Governor announced that residents who are not eligible for regular unemployment benefits can now apply online for the new Pandemic Unemployment Assistance program. This includes self-employed workers, independent contractors, gig economy workers, and those with limited work history. ",,,,,,,,,,,Y,
21-Apr-20,"The Governor announced new actions to support the ongoing response, including extending the closure of all public and private schools through the end of the school year, and the closure of all non-emergency child care programs until June 29, as well as further support for students and families who have been impacted. ",Y,,,,Y,,,,,,,
22-Apr-20,The Division of Banks joined a multi-state initiative to secure payment relief options for Massachusetts  student loan borrowers and issued a Consumer Advisory with information and resources for private student loan borrowers. ,,,,,,,,,,,Y,
22-Apr-20,The Governor's Administration announced an initiative to expand testing at Community Health Centers as well as new Wi-Fi hotspots. ,,,,Y,,,,,,,,
24-Apr-20,"The Governor filed two waiver requests with CMS that will give the state and its Medicaid program, MassHealth, more flexibility to respondto this public health emergency. ",,,,,,Y,,,,,,
27-Apr-20,"The Governor announced a second round of funding up to $130 million for nursing facilities to support response efforts over the next two months, as well as increased funding of $44 million for residential congregate care service providers. Additionally, the administration has implemented required testing for staff and residents of nursing facilities. ",,,,Y,,Y,,,,,,
28-Apr-20,The Governor extended the essential services emergency order to May 18th and launched a Reopening Advisory Board that will produce a plan to the Governor by May 18th.,,,,,,,,,,,Y,
1-May-20, The Governor issued an order requiring the use of masks or face coverings in  public places and announced expanded community health center testing  capacity. ,Y,,,Y,,,,,,,,
5-May-20,The Governor highlighted the MERT initiative that  assists local manufacturers in transitioning operations to produce personal  protective equipment and other critical items. ,,,,,,Y,,,,,Y,
7-May-20,The Governor provided updates on the COVID-19 Community Tracing Collaborative launched last month.,,,,,,,,,,,Y,
8-May-20,"In partnership with Mass League of Community Health Centers, the Governor's Administration announced a new public awareness campaign which aims to encourage residents to continue seeking medical care.",,,,,,Y,,,,,,
8-May-20,The Centers for Medicare and Medicaid Services (CMS) approved Massachusetts additional request for a Medicaid 1135 waiver.The waiver allows Massachusetts to allow for home and community-based services in additional settings.,,,,,,Y,,,,,,
11-May-20,The Governor announced a four-phase approach to reopening the Massachusetts economy and published Mandatory Workplace Safety Standards that will apply across all sectors and industries once reopening begins.,,,,,,,,,,,Y,
12-May-20,"The Governor's Administration filed a supplemental budget bill for Fiscal Year 2020 which will authorize $1 billion in spending necessary to cover incurred and expected costsduring the public health crisis, and it is expected that this spending will result in no net cost to the Commonwealth, after anticipated federal reimbursement and other federal funding sources.",,,,,,,,,,,Y,
13-May-20,"The Governor toured MatTek Life Sciences, who is participating in the Manufacturing Emergency Response Team that assists local manufacturers in transitioning operations to produce personal protective equipment.",,,,,,,,,,,Y,
13-May-20,"The Governor toured a new testing site, and reminded residents of the Department of Public Healths updated guidance about the appropriate use of laboratory testing for COVID-19 and expanded testing recommendations in clinical and commercial laboratories.",,,,Y,,,,,,,,
14-May-20,The Governor announced that his Administration will submit its plan to expand testing to the federal government this month and highlighted the delivery of over 7.5 million pieces of PPE and supplies to be delivered to front-line workers throughout the Commonwealth.,,,,Y,,Y,,,,,,
14-May-20,The Governor's Administration announced that it is preparing to distribute up to $502 million from the federal Coronavirus Relief Fund to local cities and towns.,,,,,,,,,,,Y,
15-May-20,The Governor released a partial list of employers who are committing to continuing work from home policies for the foreseeable future as a way to provide more flexibility for their employees and greater capacity for social distancing on the states public transportation system.,,,,,,,,,,,Y,
18-May-20,"The Governor released Reopening Massachusetts, the Reopening Advisory Board's report, which details a four-phased strategy to responsibly reopen businesses and activities. He also released a new Safer At Home Advisory, which instructs residents to stay at home unless engaging with newly opened activities.",Y,,,,,,,,,,,
20-May-20,"The Governor toured Symmons Industries, an 80-year-old Massachusetts manufacturer that has implemented the new Mandatory Workplace Safety Standardsas manufacturing operations scale back up.The Governor's Reopening Advisory Board also released new Sector Specific Protocols that describe policies, procedures and best practices that particular industries should follow to decrease the risk of transmission.",,,,,,,,,,,Y,
21-May-20,"The Governor announced that Massachusetts residents who are eligible for the federal CARES Act and qualify for having exhausted their regular unemployment compensation may now receive the new Pandemic Emergency Unemployment Compensation, which provides up to 13 additional weeks of benefits.",,,,,,,,,,,Y,
1-Jun-20,"The Governor issued an Executive Order that provides a detailed list of businesses and activities that fall into Phases II, III, and IV of the Commonwealth's Re-Opening Plan.",,Y,,,,,,,,,,
6-Jun-20,The Governor announced that Phase II of the Commonwealth's reopening plan will begin on June 8.,,Y,,,,,,,,,,
9-Jun-20,"The Governor filed An Act to Ensure the Collection of COVID-19 Data, which will build on legislation recently signed by the governor to expand data collection during the pandemic.The Governor also signed An Act Addressing COVID-19 Data Collection and Disparities in Treatment, which will allow for the collection and publication of additional data to understand the impact of COVID-19 on underserved and underrepresented populations and other groups.",,,,,,,,,,,Y,
15-Jun-20,The Governor announced the availability of pop-up testing sites throughout the Commonwealth for individuals who have recently participated in large gatherings.,,,,Y,,,,,,,,
18-Jun-20,"The Governor announced additional administrative tax relief measures for businesses, such as the postponing the collection of regular sales tax, meals tax, and room occupancy taxes for small businesses, as well as waiving all penalties and interest that would otherwise apply.",,,,,,,,,,,Y,
19-Jun-20,"The Governor announced that Step Two of Phase II of the Commonwealth’s four-phase reopening plan, Reopening Massachusetts, will begin on June 22.",,Y,,,,,,,,,,
26-Jun-20,"The Governor unveiled a $275 million COVID-19 economic recovery package to generate economic growth. It additionally proposes to amend the scope of several proposed programs, to target funding towards specific communities including those hardest hit, reallocate funding among proposed authorizations to better address the significant economic impacts, and establish new tools to promote equity and drive economic growth in communities and among businesses facing barriers to entry.",,,,,,,,,,,Y,
1-Jul-20,"Due to the food insecurity concerns caused by the pandemic, the Governor  highlighted an innovative partnership to help provide Boston’s most vulnerable residents with access to food by utilizing RIDE paratransit services.",,,,,,,,,,,Y,
7-Jul-20,"The Governor highlighted his “Stop the Spread” initiative, which is a data-driven effort to reduce the prevalence of COVID-19 in communities that are above the state average in total cases and positive test rate by providing free testing sites in those identified communities.  ",,,,Y,,,,,,,,
13-Jul-20,The Governor announced $16.1 million in relief for 32 special education residential school providers to support costs related to the pandemic.,,,,,,,,,,,Y,
24-Jul-20," The Governor announced that effective August 1st,  all travelers entering the Commonwealth, including both out of state residents and Massachusetts residents returning home, will be required to comply with a new travel order.",Y,,,,,,,,,,,
27-Jul-20," The Governor announced an expansion of its “Stop the Spread” initiative, which provides free COVID-19 testing in targeted communities across the Commonwealth.",,,,,,,,,,,Y,
7-Aug-20,"The Governo announced a set of initiatives, including stricter statewide rules for public and private gatherings and targeted community guidance",Y,,,,,,,,,Y,,
20-Aug-20,The Baker-Polito Administration announced testing initiatives to support K-12 schools ,,,,Y,Y,,,,,,,
25-Aug-20,Massachusetts launched “My Local MA” Campaign to drive economic activity and safely support small and local businesses  ,,,,,,,,,,,Y,
3-Sep-20,The Baker-Polito Administration stepped up its targeted initiative to help stop the spread of COVID-19 in communities across the Commonwealth with the highest number of positive cases,,,,Y,,,,,,,Y,
10-Sep-20,"The Baker-Polito Administration announced a new Nursing Facility Accountability and Supports package, a set of policy reforms and funding for nursing facilities to hold facilities to higher standards of care and infection control.",,,,,,,,,,,Y,
15-Sep-20,"Governor Charlie Baker, Lt. Governor Karyn Polito, Senate President Karen Spilka and House Speaker Robert DeLeo announced an extension of administrative tax relief measures for local businesses that have been impacted by the ongoing COVID-19 outbreak, especially in the restaurant and hospitality sectors.",,,,,,,,,,,Y,
23-Sep-20,The Baker-Polito Administration announced a new grant program to help prevent and reduce the spread of COVID-19 in communities of color.,,,,,,,,,Y,,,
24-Sep-20,"The Baker-Polito Administration announced new guidance that allows safe indoor visitation to resume in nursing homes and rest homes, and further expands indoor visitation options in assisted living residences",,Y,,,,,,,,,,
5-Oct-20,Baker-Polito Administration announced transition to Step II of Phase III for lower risk communities,,Y,,,,,,,,,,
6-Oct-20,"The Baker-Polito Administration has begun implementing its second round of comprehensive nursing home reforms to keep older adults safe, improve the standards of care and infection control, and respond to the ongoing COVID-19 pandemic.",,,,,,Y,,,,,,
7-Oct-20,The Baker-Polito Administration announced a COVID-19 Vaccine Advisory Group to advance its efforts to prepare to distribute a safe and effective COVID-19 vaccine,,,,,,,,,,,,Y
12-Oct-20,Baker-Polito Administration announced a comprehensive Eviction Diversion Initiative to keep people safely housed during pandemic,,,,,,,,,,,Y,
15-Oct-20,The Baker-Polito Administration has awarded over $6.5 Million to 13 Massachusetts organizations to develop new products to assist in the response to the COVID-19 public health emergency.,,,,,,,,,,,Y,
22-Oct-20,"The Baker-Polito Administration announced a $774 million comprehensive plan to stabilize and grow the Massachusetts economy. The plan focuses on getting people back to work, supporting small businesses, fostering innovation, revitalizing downtowns and ensuring housing stability. ",,,,,,,,,Y,,Y,
22-Oct-20,Massachusetts to temporarily pause all indoor ice rink and ice skating facilities operations for two weeks ,Y,,,,,,,,,,,
28-Oct-20,The Baker-Polito Administration announced $5.9 million in grants to address urgent food insecurity for residents across the Commonwealth as a result of the COVID-19 pandemic,,,,,,,,,,,Y,
