date,policy,Restrict/Close,Opening (State),Deferring to County,Testing,Education,Health/Medical,Emergency Level,Transportation,Budget,Social Distancing,Other,Vaccine
2-Nov-20,"The Baker-Polito Administration announced a series of targeted measures to disrupt the increasing trend of new COVID-19 cases and hospitalizations including a Stay At Home Advisory, an Executive Order including early closure of businesses and activities, a Face Covering Order, and an updated order restricting gatherings to 10 people",Y,,,,,,,,,,,
6-Nov-20,The Baker-Polito Administration and COVID-19 Command Center released updated metrics for schools and municipalities. The Department of Elementary and Secondary Education also released updated school guidance,,,,,Y,,,,,,,
13-Nov-20,Baker-Polito Administration announced re-establishment of a field hospital at the DCU Center in Worcester,,,,,,Y,,,,,,
18-Nov-20,"Baker-Polito Administration announced higher education holiday travel guidance, and first round of Abbott BinaxNOW Covid-19 point of care testing in K-12 schools",,,,Y,Y,,,,,,,
18-Nov-20,"Regional Coalition of Northeastern Governors announced colleges will be encouraged to provide testing for students before leaving for Thanksgiving break, recommend expanded remote instruction to end fall semester safely ",,,,Y,Y,,,,,,,
23-Nov-20,Get Back Mass educational campaign. ,,,,,,,,,,,y,
23-Nov-20,"Administration announces $650K in community grants to support COVID19 response, new testing resources for long term care facilities",,,,,,,,,,,y,
7-Dec-20,Baker-Polito Administration Launches New Testing Infrastructure to Increase Testing Capacity & Efficiency Statewide,,,,Y,,,,,,,,
8-Dec-20,"Baker-Polito Administration Announces Statewide Rollback to Phase Three, Step One, Additional Restrictions Effective December 13th",Y,,,,,,,,,,,
9-Dec-20,"Baker-Polito Administration announced allocation and distribution plans for the first round of COVID-19 vaccine shipments to Massachusetts set to begin around December 15. The state’s first shipment of 59,475 doses of the Pfizer vaccine was ordered from the federal government",,,,,,,,,,,Y,
15-Dec-20,"Baker-Polito Administration announced updates on the Commonwealth’s distribution efforts of the first doses of the COVID-19 vaccine as well as new guidance from the Department of Public Health (DPH) to help residents celebrate the holiday safely. DPH places vaccine orders on behalf of the providers. When vaccination begins, hospitals report data into DPH, and DPH and the Command Center will launch a public dashboard to keep track of immunizations",,,,,,,,,,,Y,Y
18-Dec-20,Baker-Polito Administration is filing legislation to sustain unemployment benefits and provide an estimated $1.3 billion in unemployment insurance relief to the Commonwealth’s employers over two years,,,,,,,,,,,Y,
21-Dec-20,"Baker-Polito Administration announced support for 1,158 small businesses impacted by COVID-19 recession",,,,,,,,,,,Y,
22-Dec-20,"The Baker-Polito Administration announced further restrictions to help stop the spread of COVID-19 in the Commonwealth, including new capacity and gathering limits",Y,,,,,,,,,,,
