date,policy,Restrict/Close,Opening (State),Deferring to County,Testing,Education,Health/Medical,Emergency Level,Transportation,Budget,Social Distancing,Other,Vaccine
19-Jun-20,The Economic Development Cabinet Secretary announced that new forgiveness and flexibility rules for the federal government’s Paycheck Protection Program will benefit more New Mexican businesses and urged those who have not yet applied to reconsider applying for a loan.,,,,,,,,,,,Y,
30-Jun-20,"The Governor authorized an amended Fiscal Year 2021 state budget (House Bill 1), using her line-item veto authority to restore legislative cuts to public education and other areas while employing state reserves, spending reductions and federal monies to patch a revenue shortfall caused by the economic fallout of the pandemic.",,,,,,,,,,Y,,
1-Jul-20,The Governor extended the state’s emergency public health order through July 15 and issued a severe warning about the risk of New Mexico being forced to reinstate severe public health restrictions in order to mitigate the spread of COVID-19 across the state.,,,,,,,,,,,Y,
2-Jul-20,The New Mexico Taxation and Revenue Department extended some modifications to its collection and enforcement efforts through July 31.,,,,,,,,,,,Y,
7-Jul-20,"The Governor delivered hundreds of millions of dollars for low-interest, low-risk loans to help small New Mexico businesses recover financially.  ",,,,,,,,,,,Y,
9-Jul-20," The Governor announced the state will re-enact emergency public health restrictions on high-contact indoor environments where face-coverings are not worn in order to slow the rising spread of COVID-19 across the state, effective July 13.",Y,,,,,,,,,,,
13-Jul-20," The Governor announced a public health emergency order re-enacting emergency public health restrictions on high-contact indoor environments where face-coverings are not worn. Specifically, the order prohibits indoor dining at restaurants and restricts indoor seating at breweries.",Y,,,,,,,,,,,
24-Jul-20,"The New Mexico Public Education Department announced updates to the state’s plan for the safe and methodical reentry into school for students and educators this fall, delaying the eligibility date for the return to in-person learning until September 8.",Y,,,,,,,,,,,
27-Jul-20, The Governor announced that applications have gone out for $178 million of CARES Act funding for tribal and local governments.,,,,,,,,,,,Y,
29-Jul-20, The New Mexico Human Services Department applied for federal approval to implement the Restaurant Meals Plan (RMP) as a means of continuing state assistance to individuals who receive SNAP benefits to have greater access to meals by allowing them to purchase prepared meals from participating New Mexico restaurants.,,,,,,,,,,,Y,
30-Jul-20,State renewed emergency public health order,,,,,,,Y,,,,,
27-Aug-20,The Governor announced revised emergency public health order that permited certain relaxations of occupancy restrictions,,Y,,,,,,,,,,
4-Sep-20,Secretary of Health Kathy Kunkel issued a public health order establishing social distancing restrictions for polling places during the fall election season,,,,,,,,,,Y,Y,
17-Sep-20,Gov. Michelle Lujan Grisham announced the state will update its guidance within the emergency public health order to permit small groups in exercise settings and safe outdoor activities,,Y,,,,,,,,,,
13-Oct-20,"Gov. Michelle Lujan Grisham announced the state of New Mexico will implement, and in some cases re-implement, several public health regulations later in the week",Y,,,,,,,,,,,
16-Oct-20,The state of New Mexico’s amended emergency public health order pertaining to mandatory quarantine upon travel out of state,Y,,,,,,,,,,,
20-Oct-20,"Gov. Michelle Lujan Grisham and state health and workplace safety officials on Tuesday announced new enhanced mitigation efforts such as the renewed directive that New Mexicans should stay home except for outings essential to health, safety and welfare to the greatest extent possible",Y,,,,,,,,,,,
21-Oct-20,"The state of New Mexico, pursuant to Gov. Michelle Lujan Grisham’s executive order requiring quarantine for out-of-state visitors arriving from high-risk states",Y,,,,,,,,,,,
23-Oct-20,"The state of New Mexico’s amended emergency public health order is in effect and includes an enhanced strategy for enforcing safety requirements at food and drink establishments offering limited indoor-dining options, a targeting of higher-risk hotspot places of business reporting clusters of infections and a statewide mandatory closing time for retail entities among other measures",Y,,,,,,,,,,,
4-Nov-20,Department of Health announced ‘Red to Green’ COVID-19 testing surge across southern N.M.,,,,Y,,,,,,,,
13-Nov-20,Gov. Michelle Lujan Grisham and state health officials on Friday announced the state of New Mexico will temporarily re-enact a statewide order closing in-person services for all non-essential activities. Food and drink establishments may provide curbside pickup and delivery services; on-site dining is prohibited.,Y,,,,,,,,,,,
18-Nov-20,Gov. Michelle Lujan Grisham and state health officials announced several tightenings intended to clarify the intent of the emergency public health order. The definition of a “retail space” has been tightened and clarified.,Y,,,,,,,,,,,
19-Nov-20,The New Mexico Department of Health opened an alternate care site at the Gibson Medical Center in Albuquerque. The site will operate as a limited care facility for recovering COVID-positive adults who do not require acute care,,,,,,Y,,,,,,
20-Nov-20,The state of New Mexico and the U.S. Department of Health and Human Services continue their COVID-19 testing partnership efforts to include five locations.,,,,Y,,,,,,,,
23-Nov-20,The New Mexico Department of Health will begin administering an FDA-approved COVID test that involves swabbing the mouth to collect a saliva sample and will start to provide negative and positive COVID test results by text,,,,Y,,,,,,,,
27-Nov-20,State announces tiered ‘Red to Green’ system for N.M. counties in next phase of COVID-19 response,y,,,,,,,,,,,
5-Dec-20,NMDOH introduces oral fluid tests to southeast test sites,,,,Y,,,,,,,,
10-Dec-20,"The New Mexico Department of Health on Thursday announced two new public health emergency orders in response to the ongoing public health crisis in New Mexico and resulting unsustainable strain on health care providers and hospitals, one temporarily limiting non-essential surgeries and another recognizing the activation of “crisis care” standards by outlining credentialing processes for COVID-19 health care providers.",,,,,,Y,,,,,,
11-Dec-20,"The New Mexico Department of Health (DOH) and the Public Education Department (PED) today announced a delay in the return to in-person learning after the winter break, in an effort to help mitigate what may be a post-holiday surge in COVID-19 cases in New Mexico and to minimize the risk of exposure in in-person learning environments during that time.",,,,,Y,,,,,,,
22-Dec-20,Health officials at the state of New Mexico issued public health guidance to New Mexicans to ensure residents are able to safely navigate the holiday season,,,,,,,,,,Y,,
13-Jan-21,New Mexico Identifies First Case of B117 Coronavirus Variant,,,,,,,,,,,Y,
11-Mar-21,The New Mexico Department of Health on Thursday announced New Mexicans 60 years and older with a chronic condition that places them at severe risk of COVID-related health complications will be prioritized for vaccination appointments within the larger pool of New Mexicans with a chronic health condition.,,,,,,,,,,,,Y
29-Mar-21,State announces that New Mexicans 75+ will no longer need event codes to schedule COVID-19 vaccine appointments,,,,,,,,,,,,Y
5-Apr-21,State announces Phase 2 COVID-19 vaccine eligibility All New Mexicans 16+ now eligible for vaccine,,,,,,,,,,,,Y
30-Apr-21,"The New Mexico Department of Health announced the updated statewide COVID-19 map, with updated key health metrics used to assign risk levels to counties under the Red-Yellow-Green COVID-19 framework now in effect. The updates to the criteria, announced by the governor and state officials, are made as the state’s nation-leading vaccine distribution effort is over time likely to reduce the number of asymptomatic people seeking out and receiving tests for COVID-19.",,,Y,,,,,,,,,
11-Nov-21,Delay in pediatric Pfizer vaccine for 5-11y/os. Will be available in the next 2 weeks.,,,,,,,,,,,,Y
18-Jan-22,"State introduces free at-home rapid testing program. New Mexico Department of Health (NMDOH) are securing over 1 million ihealth at-home rapid antigen tests for the state, to be initially distributed in areas of higher social vulnerability.",,,,Y,,,,,,,,
18-Apr-22,"A public health order issued Friday by the New Mexico Department of Health (DOH) renewed the existing public health orders related to COVID-19. The renewal has been extended through May 16, 2022.",,,,,,,Y,,,,,