date,policy,Restrict/Close,Opening (State),Deferring to County,Testing,Education,Health/Medical,Emergency Level,Transportation,Budget,Social Distancing,Other,Vaccine
3-Jun-20, The Governor announced the Office of the State Fire Commissioner will be working to enact recent legislation to provide $50 million in direct financial relief to fire and medical service companies negatively impacted by the ongoing COVID-19 response.,,,,,,,,,,,Y,
8-Jun-20," The Governor announced the launch of an enhanced dashboard that captures data on demographics of cases, demographics of deaths and the states reopening status.",,,,,,,,,,,Y,
8-Jun-20, The Governor announced a $225 million statewide grant program to support small businesses that were impacted by the pandemic.,,,,,,,,,,,Y,
9-Jun-20," The Governor announced that beginning on June 10, five additional drive-thru testing sites will open in Walmart parking lots across the state.",,,,Y,,,,,,,,
10-Jun-20," The Governor released updated guidance regarding the types of outdoor recreation that businesses may offer during the yellow and green phases of reopening, and how they may do so safely, as the commonwealth continues to open its own public recreation facilities across the state.",,,,,,,,,,,Y,
10-Jun-20, The Governor issued preliminary guidance for high school and recreational sports teams to resume voluntary workouts and other in-person activities in the states yellow and green phases.,,,,,,,,,,,Y,
10-Jun-20, The Governor outlined the potential impact of ending the March 6 disaster declaration while clarifying that the legislature cannot end it unilaterally.,,,,,,,,,,,Y,
11-Jun-20, The Governor and Secretary of Health signed amended green phase orders for the 12 counties moving to the green phase of reopening on June 12.,,,,,,,,,,,Y,
12-Jun-20, The Governor announced eight more counties will move to the green phase of reopening on June 19.,,Y,,,,,,,,,,
12-Jun-20," The Governor announced that the state is among a select few with a steady decline in cases, a positive indicator that the states phased, measured reopening plan is working to balance public health with economic recovery.",,,,,,,,,,,Y,
15-Jun-20," The Governor announced nine additional COVID-19 drive-thru testing sites will open in Walmart parking lots across the state, beginning on June 17, bringing the total to 19 sites at Walmart locations.",,,,Y,,,,,,,,
15-Jun-20," The Governor announced that individuals with intellectual disabilities, autism and the providers of support services for these vulnerable populations will receive $260 million in CARES Act funding to help provide a continuity of services.",,,,,,,,,,,Y,
16-Jun-20,The Governor announced more than $10 million in funding through the federal HOME Investment Partnerships Program to support affordable housing projects across the commonwealth.,,,,,,,,,,,Y,
16-Jun-20,The Governor announced the availability of $40 million in funding through the federal CARES Act to support Pennsylvania’s dairy industry and food security programs.,,,,,,,,,,,Y,
16-Jun-20,The Governor announced that the School Safety and Security Committee approved the opening of two funding announcements totaling $157.5 million that school entities are immediately eligible to apply for to address COVID-19-related health and safety needs for the 2020-2021 school year.,,,,,Y,Y,,,,,,
17-Jun-20,"The Governor announced the seven project awardees of $175,603 in new funding through the Manufacturing PA Innovation Program COVID-19 Challenge to address the commonwealth’s response to the COVID-19 pandemic.",,,,,,,,,,,Y,
17-Jun-20,"The Governor announced that Pennsylvania is one of three states that has had a downward trajectory of COVID-19 cases for more than 42 days, according to the Centers for Disease Control and Prevention proprietary data for states. The other two states are Montana and Hawaii.",,,,,,,,,,,Y,
18-Jun-20,The Governor reminded Pennsylvanians that mask-wearing is required when entering any business in all counties in the state in both yellow and green phases of reopening.,,,,,,,,,,,Y,
18-Jun-20,The Governor and Secretary of Health signed amended green phase orders for the 8 counties moving to green on June 19.,,Y,,,,,,,,,,
19-Jun-20,The Governor announced that 12 additional counties will move to the green phase of reopening on June 26.,,Y,,,,,,,,,,
23-Jun-20,The Governor noted that research confirms the importance of wearing masks to stop the spread of COVID-19 and that Pennsylvanians are required to wear masks when entering any business in all counties in both yellow and green phases of reopening.,Y,,,,,,,,,,,
25-Jun-20, The Governor signed amended green phase orders for the 12 counties moving to green on June 26.,,,Y,,,,,,,,,
26-Jun-20, The Governor announced the availability of $20 million in grant funding for cultural organizations and museums to offset lost revenue.,,,,,,,,,,,Y,
26-Jun-20," The Governor announced that Lebanon County is slated to move to the green phase of reopening on July 3, putting all 67 counties in green.",,,Y,,,,,,,,,
26-Jun-20, The Governor reminded all Pennsylvania residents and businesses that masks are mandatory when visiting a business.,Y,,,,,,,,,,,
28-Jun-20," The Governor commended the Allegheny County Executive and Health Department for the additional mitigations the county is putting in place in response to significant COVID-19 case increases over the past few days, emphasizing that the situation in Allegheny County is a reminder for the entire state to follow mask-wearing and other mitigation requirements.",Y,,,,,,,,,,,
29-Jun-20," The Governor announced that small businesses across Pennsylvania can apply for grants, beginning June 30, to offset lost revenue caused by the COVID-19 pandemic and the resulting shutdown order.",,,,,,,,,,,Y,
1-Jul-20,"The Governor announced more than 310,000 Pennsylvanians have received their rebates early through the Property Tax/Rent Rebate Program, which provides support to older homeowners, renters and people with disabilities.",,,,,,,,,,,Y,
1-Jul-20,The Pennsylvania Secretary of Health signed a business safety order requiring face coverings in all public places.,Y,,,,,,,,,,,
2-Jul-20,The Governor advised Pennsylvanians that wearing masks when outside the home is mandatory.,Y,,,,,,,,,,,
2-Jul-20,"The Governor signed an amended green phase order for the last Pennsylvania county to move to green, scheduled for July 3.",,Y,,,,,,,,,,
4-Jul-20,The Governor reminded Pennsylvanians of the benefits of wearing masks.,,,,,,,,,,,Y,
6-Jul-20,The Governor announced that 309 nonprofit arts organizations will receive grants totaling $2.3 million to help mitigate the impact of the pandemic.,,,,,,,,,,,Y,
6-Jul-20,The Governor announced $53 million in additional financial support for child care providers that have been economically hardest hit. ,,,,,,,,,,,Y,
6-Jul-20,The Governor’s Administration highlighted recent research studies that further point to the importance of wearing masks to stop the spread of COVID-19 and save lives.,,,,,,,,,,,Y,
9-Jul-20,"The Governor announced $10 million in CARES Act funding is available for businesses that have worked to maintain access to fresh, healthy food throughout the pandemic.",,,,,,,,,,,Y,
9-Jul-20,"The Governor issued an executive order that protects homeowners and renters from eviction or foreclosure until August 31, the order is aimed at individuals or families that have not already received relief from other state or federal programs. ",,,,,,,,,,,Y,
9-Jul-20,"The Governor released an updated FAQ on summer recreation facilities, camps and pools.",,,,,,,,,,,Y,
10-Jul-20,The Governor announced nearly $19 million in funding awards to assist in mitigating the impacts of the coronavirus on homeless families and individuals and to prevent future homelessness across the commonwealth.,,,,,,,,,,,Y,
10-Jul-20,The Governor issued an executive order authorizing state agencies to conduct administrative proceedings remotely.,,,,,,,,,,,Y,
15-Jul-20,"The Governor signed an executive order for targeted mitigation efforts influencing the decision for statewide mitigation efforts for bars and restaurants, gatherings and telework.",,,,,,,,,,,Y,
16-Jul-20,"The Governor announced the availability of $10 million in grant funding through the COVID-19 Vaccines, Treatments, and Therapies (CV-VTT) program to support the rapid advancement of vaccines, treatments, and therapies by qualified biotechnology entities in response to the COVID-19 pandemic.",,,,,,Y,,,,,,Y
16-Jul-20,The Governor announced the availability of $50 million in grant funding to help employers provide hazard pay to employees in life-sustaining occupations during the COVID-19 pandemic.,,,,,,,,,,,Y,
17-Jul-20,The Pennsylvania Department of Health updated its travel recommendations to remove Delaware from the list of states recommended for domestic travelers returning from to quarantine for 14 days upon return to Pennsylvania.,,,,,,,,,,,Y,
23-Jul-20," The Governor signed HB 1459 into law, which establishes a mental wellness and stress management program for first responders who experience post-traumatic stress injuries or traumatic brain injuries on the job.",,,,,,,,,,,Y,
27-Jul-20, The Pennsylvania Office of Advocacy and Reform released the Trauma-Informed PA plan to guide the commonwealth and service providers statewide on what it means to be trauma-informed and healing-centered in PA.,,,,,,,,,,,Y,
28-Jul-20,The Governor dedicated approximately $3 million for Preschool Early Intervention Programs serving children 3 to 5-years-old to purchase personal protective equipment and other pandemic-related supplies.,,,,,,,,,,,Y,
3-Aug-20,Governor Tom Wolf dedicated approximately $28 million to postsecondary institutions and adult basic education providers to assist them in implementing public health and safety plans,,,,,Y,,,,Y,,,
6-Aug-20,"The Pennsylvania Department of Health and Department of Education recommended that Pre-K–12 school and recreational youth sports be postponed until at least Jan. 1, 2021",Y,,,,Y,,,,,,,
10-Aug-20,Gov. Wolf announced $96 million for small businesses impacted by COVID-19,,,,,,,,,Y,,Y,
17-Aug-20,Gov. Wolf announced new funding for York small business impacted by COVID-19,,,,,,,,,Y,,Y,
17-Aug-20,Wolf Administration granted hazard pay to front-line workers in life-sustaining industries,,,,,,,,,,,Y,
1-Sep-20,Gov. Wolf signed second renewal of COVID-19 Disaster Declaration for State Response and Recovery,,,,,,,Y,,,,,
17-Sep-20,Wolf Administration signed orders that restaurants may increase indoor occupancy to 50 percent,,Y,,,,,,,,,,
22-Sep-20,Wolf Administration launched COVID Alert PA App and encouraged PA to unite to stop the spread,,,,,,,,,,,Y,
5-Oct-20,Gov. Wolf announced additional $96 million for small businesses impacted by COVID-19,,,,,,,,,Y,,Y,
8-Oct-20,"Gov Wolf announced $50 million in grants to be awarded to support fire, rescue and EMS companies negatively sffected by COVID-19",,,,,,,,,Y,,Y,
13-Oct-20,Governor Tom Wolf announced the Pennsylvania Housing Finance Agency is improving the COVID Relief Mortgage and Rental Assistance Grant Program to help more renters and homeowners remain in their homes.,,,,,,,,,,,Y,
22-Oct-20,Governor Wolf announced plan to waive liquor license fees to provide financial relief to restaurants and bars,,,,,,,,,,,Y,
5-Nov-20,Governor Wolf announced new funding available to protect homeless Pennsylvanians during COVID-19 resurgence,,,,,,,,,,,Y,
16-Nov-20,Governor Tom Wolf reminded Pennsylvanians the state’s existing mitigation efforts remain in place and are more important than ever to understand and follow,,,,,,,,,,,Y,
17-Nov-20,"Wolf Administration announced additional mitigation efforts which include protecting the health care system with restrictions on elective surgeries, new traveler testing order, strengthened masking order, and recommendations for colleges and universities",Y,,,,,,,,,,,
18-Nov-20,"Regional Coalition of NE Governors announced colleges will be encouraged to provide testing for students before leaving for Thanksgiving break, recommendations to end fall semester safely",,,,Y,Y,,,,,,,
23-Nov-20,"Governor Tom Wolf and Secretary of Health Dr. Rachel Levine announced new targeted mitigation measures. These measures include revamped school safety attestation, targeted business and gathering restrictions, mandatory teleworking unless impossible, and a new enforcement plan that includes liability protection for businesses enforcing the Secretary of Health’s strengthened mask-wearing order",Y,,,,,,,,,,,
25-Nov-20,Wolf Administration will begin using the national Wireless Emergency Alert (WEA) system to provide important public messages about the COVID-19 pandemic,,,,,,,,,,,Y,
25-Nov-20,"Department of Health Secretary Dr. Rachel Levine today updated the travel order issued on November 17, to clarify testing and quarantine requirements for people entering the commonwealth or returning home.",,,,,,,,Y,,,,
1-Dec-20,Wolf Administration Expands Testing Sites Across the Commonwealth,,,,Y,,,,,,,,
9-Dec-20,"Tom Wolf, Governor of the Commonwealth of Pennsylvania, proclaims December 10, 2020, to be GET COVERED 2021 PENNSYLVANIA DAY.",,,,,,,,,,,Y,
12-Dec-20,Governor Tom Wolf and Secretary of Health Dr. Rachel Levine today implored Pennsylvanians to take the next three weeks and stand united against the virus by adhering to existing mitigation orders and stricter efforts announced today.,Y,,,,,,,,,,Y,
14-Dec-20,"Governor Tom Wolf held a virtual press conference to highlight the work of the team behind Pennsylvania’s new state-based health insurance marketplace, known as Pennie, and to encourage Pennsylvanians to visit pennie.com for affordable coverage options.",,,,,,Y,,,,,Y,
30-Dec-20,Health Secretary Signs Order Directing Vaccine Access for Health Care Personnel,,,,,,Y,,,,,,Y
30-Dec-20,COVID-19 Vaccine Federal Pharmacy Partnership for Long-Term Care Program Kicks Off Across Commonwealth. 126 Skilled Nursing Facilities to Receive Pfizer-BioNTech COVID-19 Vaccine,,,,,,,,,,,Y,Y
30-Dec-20,Department of Health Launches COVID-19 Vaccine Dashboard to Provide Updates on Distribution Process,,,,,,,,,,,,Y
7-Jan-21,The Pennsylvania departments of Health (DOH) and Education (PDE) today provided school administrators and school boards with updated recommendationsOpens In A New Window as to which instructional models they should consider using based on the changing levels of community transmission of COVID-19 in their counties,,,Y,,Y,,,,,,,
7-Jan-21,"Secretary of Health Dr. Rachel Levine today announced the first confirmed case of the COVID-19 variant, SARS-CoV-2 B.1.1.7, in Pennsylvania.",,,,,,,,,,,Y,
13-Jan-21,Governor Tom Wolf urged the General Assembly to act now to allocate $145 million that is available now to provide much needed support to Pennsylvania businesses that have been adversely affected by the COVID-19 public health crisis.,,,,,,,,,Y,,,
14-Jan-21,"Governor Tom Wolf is dedicating $2.2 billion in federal stimulus funds to K-12 school districts and charter schools affected by the COVID-19 pandemic to support food programs, technological improvements and other education services.",,,,,Y,,,,Y,,,
19-Jan-21,"The Pennsylvania Department of Health today released the latest revised COVID-19 vaccination plan that includes people who are 65 and older, and those 16-64 with certain underlying medical conditions that make them more vulnerable to the disease.",,,,,,,,,,,,Y
20-Jan-21,Wolf Administration Announces $600 Pandemic Relief Awards to Eligible Child Care Employees Across Pennsylvania,,,,,,,,,y,,Y,
20-Jan-21,Pennsylvania Partners with Rite Aid to Vaccinate Priority Populations in Congregate and Long-Term Care Settings,,,,,,,,,,,,Y
9-Feb-21,The Pennsylvania Department of Health launched a new tool called Your Turn. It Opens In A New Window to help Pennsylvanians understand where they fall in the vaccine prioritization effort and to be alerted when it is their turn to schedule an appointment for the COVID-19 vaccine.,,,,,,,,,,,,Y
10-Feb-21,Governor Tom Wolf announced that $145 million in funding will be distributed to all 67 Pennsylvania counties through the COVID-19 Hospitality Industry Recovery Program to help support the commonwealth’s hospitality industry. Funding will be provided in the form of block grants to each county based on population,,,Y,,,,,,Y,,,
25-Feb-21,"Under the updated guidance, people who have had both doses of a two-dose vaccine, or one dose of a single dose vaccine, do not need to quarantine after an exposure to another person with COVID-19 if they meet all the following criteria: They are fully vaccinated (i.e., more than two weeks following receipt of the second dose in a two-dose series, or of one dose of a single-dose vaccine); They are within three months following receipt of the last dose in the series; and They have remained asymptomatic since the current COVID-19 exposure. ",,,,,,Y,,,,,Y,Y
1-Mar-21,"Wolf Administration announced revised and lifted mitigation restrictions that are effective statewide today. Revisions include: Revised maximum occupancy limits for indoor events to allow for 15% of maximum occupancy, regardless of venue size, Revised maximum occupancy limits for outdoor events to allow for 20% of maximum occupancy, regardless of venue size and Eliminate out-of-state travel restrictions.",,Y,,,,,,,,Y,,
3-Mar-21,"Governor Wolf signed House Bill 326, which permits the Pennsylvania National Guard (PANG), in conjunction with the Pennsylvania Department of Health, to develop plans for the establishment and operation of regional sites for community distribution and administration of pharmaceuticals, medical equipment and supplies, and vaccines for a virus, including COVID-19. The bill also requires a report on the Administration’s plans to incorporate the National Guard into its overall vaccination strategy while taking into account vaccine availability and other vital ongoing missions.",,,,,,Y,,,,,Y,
3-Mar-21,"Governor Tom Wolf and the COVID-19 Vaccine Task Force announced that Pennsylvania will use the Johnson & Johnson (Janssen) single-dose COVID-19 vaccine for PreK-12 teachers and other school staff. Pennsylvania Emergency Management Agency and the departments of Education and Health are partnering with the 28 Intermediate Units (IUs) to establish vaccine sites. The Pennsylvania National Guard and AMI Expeditionary Healthcare (AMI) will administer the vaccine. Philadelphia operates its own separate vaccine distribution. The vaccination of educators is separate from the ongoing Phase 1A vaccine rollout, which continues at an accelerated pace.",,,,,Y,,,,,,,Y
3-Mar-21,"Department of Health Launches PA Project Firstline to Provide Easy, Accessible Infection Prevention and Control Knowledge to Frontline Healthcare Workers",,,,,,Y,,,,,Y,
3-Mar-21,"Wolf Administration Extends Regional Congregate Care Assistance Teams to Continue Support to Long-Term Care Facilities Facing COVID-19, Highlights Progress Vaccinating Long-Term Care Residents and Staff",,,,,,,,,,,Y,Y
10-Mar-21,"Wolf Administration Highlights Free, Subsidized Public Transit to Vaccine Appointments",,,,Y,,,,Y,,,,
15-Mar-21,"Gov. Wolf announces that Effective April 4, More Options for Restaurants and Other Businesses, Mass Gathering Maximums Increase. Effective April 4, restaurants may resume bar service; alcohol service will be allowed without the purchase of food; the curfew for removing alcoholic drinks from tables will be lifted; and indoor dining capacity will be raised to 75 percent for those restaurants that are currently self-certified and those that undergo the self-certification process, which involves agreeing to strictly comply to all public health safety guidelines and orders, including the cleaning and mitigation protocols and other operational requirements contained in the Governor and Secretary of Health’s mitigation and enforcement orders issued on November 23, 2020, as amended. Those restaurants that do not self-certify may raise capacity to 50 percent. Outdoor dining, curbside pick-up and takeout are still encouraged.",,Y,,,,,,,,,,
22-Mar-21,"Secretary of Health Alison Beam today amended the existing Universal Face Coverings. Opens In A New Window order, issued on November 17, 2020, to align with the Centers for Disease Control and Prevention’s (CDC) Recommendations for Fully Vaccinated PeopleOpens In A New Window. The amended order went into effect at 12:01 a.m. on March 17, 2021 and will remain in effect until further notice.",,,,,,,,,,,Y,
30-Mar-21,"Pennsylvania departments of Health (DOH) and Education (PDE) today announced updated recommendations for K-12 schools on social distancing in classrooms and how to handle COVID-19 cases in school buildings. The Department of Health also announced updated guidance on summer camps, which is mostly unchanged from what was issued last July.",,,,,Y,,,,,Y,,
31-Mar-21,"The Department of Health (DOH) in conjunction with the COVID-19 Vaccine Task Force today announced the start of the special initiative to vaccinate targeted industry workers and to accelerate the vaccination timetable for those in Phases 1B, 1C and 2. All Pennsylvanians will be eligible to schedule vaccination appointments beginning April 19.",,,,,,,,,,,,Y
5-Apr-21,Pennsylvanians in Phase 1B Now Eligible for COVID-19 Vaccine,,,,,,,,,,,,Y
13-Apr-21,Gov. Wolf and COVID-19 Vaccine Task Force Announce that All Adults in Pennsylvania are Eligible  to Schedule COVID-19 Vaccination Appointments. The timeline of universal adult access to April 13.,,,,,,,,,,,,Y
27-Apr-21,Department of Health Updates Mask Guidance Following CDC Announcement,,,,,,,,,,,Y,
13-May-21,Department of Health Mask Order Reflects Latest CDC Guidance for Fully Vaccinated Individuals,,,,,,,,,,,Y,Y
20-May-21,Gov. Wolf Signs Renewal of COVID-19 Disaster Declaration to Aid in Recovery,,,,,,,,,Y,,,
14-Jun-21,"Gov. Wolf Signs Bills Extending COVID-19 Emergency Regulation Suspensions, Expanding Family Caregiver Supports",,,,,,,Y,,,,Y,
1-Jul-21,"Gov. Wolf vetoed Senate Bill 618, anti-vaccination legislation that would severely limit medical providers and the public from having access to vital information on vaccination rates and vaccine efficacy.",,,,,,Y,,,,,,
30-Jul-21,Department of Health Launches Text Messaging Initiative to Get More Pennsylvanians Fully Vaccinated,,,,,,,,,,,,Y
10-Aug-21,Gov. Wolf announced that commonwealth employees in state health care facilities and high-risk congregate care facilities will be required to be fully vaccinated against COVID-19,,,,,,,,,,,,Y
16-Aug-21,Wolf Administration Directs Vaccine Providers to Support COVID-19 Vaccination Clinics and Unveils Free COVID-19 Testing Program for Schools Across Pennsylvania,,,,,Y,,,,,,,Y
31-Aug-21,"Wolf Administration Requires Masking in Schools, Early Learning and Child Care Settings to Keep Students Safely in Classrooms",,,,,Y,,,,,,Y,
20-Nov-21,Department of Health: All Adults Now Eligible for COVID-19 Vaccine Boosters,,,,,,,,,,,,Y
18-Jan-22,Department of Health Adds New Free COVID-19 Test Sites Across Pennsylvania,,,,Y,,,,,,,,
30-Mar-22,"Governor Wolf Signs Bill Extending Waivers to Assist Continued Recovery from Pandemic. Senate Bill 1019 temporarily extends certain suspensions of regulations and statutes that were issued by agencies under the COVID-19 disaster declaration through June 30, 2022. The continued suspension of these regulations and statutes allows the commonwealth to use all necessary resources to continue its recovery from the COVID-19 pandemic and help Pennsylvania get back on track from the pandemic",,,,,,,,,,,Y,
17-May-22,"Pennsylvania departments of Health (DOH) and Human Services (DHS) today highlighted a partnership between the agencies, health centers in Harrisburg and Reading, and Medical Assistance managed care organizations to host vaccination clinics in the cities to encourage COVID-19 vaccination to make for a safer summer. Vaccines are available by appointment and walkup. ",,,,,,,,,,,,Y