date,policy,Restrict/Close,Opening (State),Deferring to County,Testing,Education,Health/Medical,Emergency Level,Transportation,Budget,Social Distancing,Other,Vaccine
28-May-20," The Governor announced the state will make an additional $5 million available for the Housing Help RI emergency rental assistance fund. Those who qualify can receive a grant of up to $5,000 to support past due rent payments and other fees.",,,,,,,,,,,Y,
29-May-20, The Rhode Island lottery announced the Twin River casinos in Lincoln and Tiverton will begin a limited invitation-only reopening on June 8.,,Y,,,,,,,,,,
29-May-20, The Department of Environmental Management announced that all Rhode Island state beaches will be open to visitors with new restrictions in place beginning June 1.,,Y,,,,,,,,,,
29-May-20, The Governor announced the state will move into Phase 2 on June 1.,,Y,,,,,,,,,,
31-May-20, The Rhode Island Board of Elections has authorized mail ballot return drop boxes to be installed at the 47 polling places set to open for the Presidential Preference Primary on June 2.,,,,,,,,,,,Y,
1-Jun-20, The Governor advised Rhode Islanders to prepare for the 2020 Atlantic Hurricane Season and take special precautions to protect themselves from COVID-19 in their hurricane planning.,,,,,,,,,,,Y,
10-Jun-20, The Governor announced all school districts are aiming to return to in-person learning on August 31.,,,,,Y,,,,,,Y,
10-Jun-20," The Governor announced the state will provide financial support to districts as they implement their individual reopening plans, with a focus on equity, including a prioritization of resources for hardest hit communities.",,,,,,,,,,,Y,
10-Jun-20," The Governor announced that, for the first time, Supplemental Nutrition Assistance Program (SNAP) participants are now able to select and pay for their groceries online using their EBT card at Amazon and participating Walmart stores.",,,,,,,,,,,Y,
10-Jun-20, The Governor announced the Department of Human Services received approval to issue a Rhode Island Works emergency payment to families currently receiving these RI Works benefits.,,,,,,,,,,,Y,
12-Jun-20," The Attorney General announced that his office has issued guidance reminding nursing homes, assisted living facilities, and long-term care facilities that they are not permitted to seize, retain, or confiscate a residents federal stimulus payment.",,,,,,,,,,,Y,
12-Jun-20, The Governor announced asymptomatic restaurant workers and bus drivers can now receive free testing.,,,,Y,,,,,,,,
12-Jun-20," The Governor announced that the state is allocating $500,000 in financial incentives to landlords that rent to housing-insecure or homeless Rhode Islanders.",,,,,,,,,,,Y,
12-Jun-20, The Governor launched a website dedicated to tracking coronavirus spending.,,,,,,,,,,,Y,
26-Jun-20," The Rhode Island Department of Labor and Training announced new maximum weekly benefit amounts for unemployment and temporary disability insurance programs, beginning July 1.",,,,,,,,,,,Y,
29-Jun-20, The Governor announced the state will move into Phase 3 on June 30.,,Y,,,,,,,,,,
29-Jun-20," The Governor extended the following executive orders through August 3: Face coverings: Face coverings must be worn in public – both indoors and outdoors – whenever six feet of social distance cannot be maintained; Telemedicine: Health insurers must cover telemedicine for primary care, specialty care, and mental and behavioral health care conducted over the phone or by videoconference. Reimbursement rates for providers must be the same as reimbursement rates for in-office visits; Disaster declaration: The state of emergency declaration ensures that Rhode Island has access to all the necessary resources to support the response to the pandemic; Firearms: The Governor extended the time period that law enforcement has to complete a background check for a gun permit from seven days to 30 days; Quarantine: People must follow the state’s quarantine and isolation guidance.",,,,,,,,,,Y,Y,
30-Jun-20,The Department of Environmental Management announced that four Rhode Island state campgrounds are now open to visitors with new restrictions and procedures to prevent viral transmission.,,Y,,,,,,,,,,
2-Jul-20,The Governor announced a plan to expand home-based care options in Rhode Island to shift from the reliance on nursing and other congregate care facilities.,,,,,,,,,,,Y,
3-Jul-20,"The Governor announced long-term care and assisted living facilities will be allowed to welcome visitors again on July 8, provided that they abide by strict infection control measures and keep residents, staff and family members safe.",,Y,,,,,,,,,,
7-Jul-20,The Rhode Island Department of Health advised consumers not to use hand sanitizer manufactured by Eskbiochem SA de CV because of the potential presence of methanol (wood alcohol).  ,,,,,,,,,,,Y,
9-Jul-20,The Rhode Island Elections Task Force released a series of recommendations to ensure that Rhode Island voters can cast their ballots in a safe and secure manner this fall.,,,,,,,,,,,Y,
15-Jul-20," The Rhode Island Department of Health announced the coordination of a second, expanded round of serology testing in the coming weeks to better understand the prevalence of COVID-19 among people in certain high-contact professions across the state.",,,,Y,,,,,,,,
16-Jul-20,The Governor announced $100 million in emergency financial support for Rhode Island’s small businesses that have been impacted by the COVID-19 pandemic.,,,,,,,,,,,Y,
17-Jul-20,"The Rhode Island Department of Health announced it has been made aware by a private laboratory of 113 false positive COVID-19 test results for Rhode Islanders, which means 113 people were told that their results were positive when they were actually negative.",,,,Y,,,,,,,,
20-Jul-20,The Rhode Island Department of Health announced that a new COVID-19 testing site will open at the Rhode Island Convention Center in Providence.,,,,Y,,,,,,,,
28-Jul-20," The Governor announced increases to the proposed Housing and Infrastructure Bond and the Beach, Clean Water and Green bond in her recommended FY21 budget to continue its long-term investments in housing and infrastructure while paving the way for a more sustainable and equitable economy in Rhode Island.",,,,,,,,,,,Y,
28-Jul-20," The Governor announced an investment of $45 million, using CARES Act funding, for a workforce development partnership that will create thousands of job opportunities for Rhode Islanders displaced by COVID-19 and help break down barriers to hiring.",,,,,,,,,,,Y,
29-Jul-20,The Rhode Island Department of Health issued compliance orders to ten restaurants and bars so far this week for failing to comply with a range of public health directives related to COVID-19.,,,,,,,,,,,Y,
17-Sep-20,"Governor Raimondo convened a task force to support cities, towns as they build long-term economic resiliency",,,Y,,,,,,,,,
14-Sep-20,"Rhode Island's comprehensive school testing program opened and is able to provide prompt results to any student, teacher, or staff member at any public or private Pre-K – 12 school throughout the state who needs to be tested for COVID-19",,,,Y,Y,,,,,,,
2-Nov-20,"The Rhode Island Department of Health (RIDOH) is recommending that all hospitals, nursing homes, and assisted living communities restrict visitation for the next two weeks",Y,,,,,,,,,,,
19-Nov-20,"Governor Raimondo issued a statewide 'pause' limiting social gatherings to one household, introducing early businness closures, limiting indoor dining to 33% capacity, recommending remote work for all employees, and closing bars across the state",Y,,,,,,,,,,,
14-Dec-20,The Rhode Island Department of Health (RIDOH) has received a recommendation from the Rhode Island COVID-19 Vaccine Subcommittee for hospitals to begin vaccinating frontline hospital workers against COVID-19.,,,,,,,,,,,,Y
17-Dec-20,"In anticipation of Winter Storm Gail, all State-run COVID-19 testing sites will be closed December 17.",,,,Y,,,,,,,,
24-Dec-20,"The RI State Council on the Arts (RISCA) has awarded close to $1 million in Covid Relief Funds (CRF) to artists, professional arts education associations, and arts and culture organizations.",,,,,,,,,,,Y,
28-Jan-21,"The Rhode Island Department of Health (RIDOH) announced a plan today for the next phase of the State's COVID-19 vaccination campaign. The plan incorporates national public health guidance and local advisory committee input, making vaccine available to Rhode Islanders over the coming months based on age, geography, and health status.",,,,,,,,,,,,Y
16-Feb-21,U.K. COVID-19 Variant Identified in Rhode Island,,,,,,,,,,,Y,
17-Feb-21,COVID-19 Vaccine Registration Now Open to All Rhode Islanders 75+,,,,,,,,,,,,Y
22-Feb-21,COVID-19 Vaccine Eligibility Opens to Rhode Islanders 65 and older,,,,,,,,,,,,Y
22-Feb-21,Federal Shipping Delays Impacting COVID-19 Vaccination Clinics in Rhode Island,,,,,,,,,,,,Y
3-Mar-21,Rhode Island is expanding its COVID-19 Testing Program for Businesses by launching a new COVID-19 Business Testing Contact Center,,,,Y,,,,,,,Y,
10-Mar-21,"Governor Dan McKee announced that the state of Rhode Island is partnering with cities and towns on an ambitious plan to get first doses of COVID-19 vaccine to all K-12 teachers, school staff, and child care workers by the end of the month.",,,,,,,,,,,,Y
11-Mar-21,"COVID-19 vaccination eligibility will open on Friday for Rhode Islanders who are 60 to 64 years of age and who are 16 to 64 with specific underlying health conditions, Governor Dan McKee and the Rhode Island Department of Health (RIDOH) are announcing today.",,,,,,,,,,,,Y
20-Apr-21,Governor Dan McKee and the Rhode Island Department of Health (RIDOH) today announced that COVID-19 vaccine eligibility has been expanded to all Rhode Islanders 16 and older.,,,,,,,,,,,,Y
27-Apr-21,Rhode Island to Resume Johnson and Johnson Vaccine Administration,,,,,,,,,,,,Y
30-Apr-21,"Governor Dan McKee and the Rhode Island Department of Health (RIDOH) are working with colleges and universities throughout Rhode Island to make COVID-19 vaccines as accessible as possible for all students, faculty, and staff before the spring semester ends.",,,,,Y,,,,,,,Y
13-May-21,Rhode Island to Eliminate Residency Requirement for COVID-19 Vaccination ,,,,,,,,,,,,Y
14-Jun-21,"Due to a shift in strategy and focus in the State's COVID-19 response, Governor Dan McKee and the Rhode Island Department of Health (RIDOH) are announcing their plan to consolidate State-run COVID-19 test sites.",,,,Y,,,,,,,,
18-Jun-21,"Rhode Island Department of Health Lift COVID-19 Restrictions on Remaining ""Higher Risk"" Activities. The activities and settings include: live indoor performances, indoor hookah, saunas and whirlpools, and nightclubs. These settings and activities continue to be higher risk for people who are not fully vaccinated.",,Y,,,,,,,,,Y,
18-Aug-21,State to Require Immunization Against COVID-19 for All Licensed Healthcare Workers,,,,,,Y,,,,,,Y
21-Sep-21,"Governor Dan McKee and the Rhode Island Department of Health (RIDOH) announce an enforcement strategy for Rhode Island's COVID-19 vaccination requirement for healthcare workers. The enforcement strategy will help safeguard patients, residents, and staff by holding health professionals and facilities accountable to the October 1 vaccination requirement, while also preventing disruptions to care in Rhode Island as healthcare facilities work toward full compliance.",,,,,,,,,,,,Y
13-Dec-21,Omicron Variant Identified in Rhode Island,,,,,,,,,,,Y,
11-Jan-22,Governor Dan McKee announced several initiatives address the staffing capacity issues facing many of our state's health care facilities.,,,,,,Y,,,,,,